{
  "schema_version": "principia.review/3.0",
  "role": "computational",
  "reviewer_id": "",
  "bindings": {
    "claims_sha256": "92633502c925894ad6637cde270741c68f84b60c5dd9b884296867f02b5fa2f3",
    "evidence_sha256": {
      "E001": "133cf2f0f645a9df455935e756a1b1307f5ee5841b5158a5dbc809014c79235c",
      "E002": "8492d03251b8ca32f7ee18e4379815cdf0cc8bf361e79f7c2558921313a21850",
      "E003": "7d59bb7c1ded6c8c884f63a97ada378ce6ea100b553c299822ae1099f4cb442f",
      "E004": "68d96ed23e0ebc718e7c7914f5bff89162139fd653baa66a3a4466f808104e37",
      "E005": "d464c9e4d922c968811368c9f2d0e9f8cb34ac6f41faa007f1d9fd3ada4f2415",
      "E006": "8242ee67b837b070e0ac0e415de34617fb933fdc32507b496f8543ef6f218d03",
      "E007": "bdb144f48fd3c83a985ea949eea469bb283a77fc810d48fe496251bfdb6616bf",
      "E008": "43cd1dca60ccb46440565fd9715fffcb788faad4236fd687b24c0c0cf348b4a8",
      "E009": "302851b70e6761d9ed619bdc0fe4c6099bfe90537e7a0374f650dee2e8c497c9",
      "E010": "56c0b6e18073d9f651b7b3f2332be8a078ee6dc5ab2cdbdfd35f841b2164b80a",
      "E011": "5ad7a739157ff9d24d1e0be065008775b57132b6a1d30d7105ed9964055c670d",
      "E012": "5e707f4b42305425df8a8e69168a9de49f863f6903fb6cb51f3ad828cd165890",
      "E013": "e044b4f0c51c0081117ba431632d8ac3650bec54f1b529c0c317ecfdc80da3f9",
      "E014": "faf6c5428caac2bb8dabf12f11abc5aa18e9be2069bb9c39865c1f8db107b761",
      "E015": "9e7cd8e7b01793f362db83090101876d43d6c196bcd6765707b53e72fda969b7",
      "E016": "3239fd3c02c8b7ce086840e2bc6395c70a735f649efd19276b705347006200cf",
      "E017": "3bc467895437e91a198ca4434e0df4b9e338ef4353ed3e6fec1329a65e53676c",
      "E018": "99873232eecc90d39609cdf6fe2608a04aa41dc4906545cfd5c1eb5edd82af9d",
      "COMPUTATIONAL": "36607c841fe80501f96c2640dd480703b93c6741c424eab3b4c315f27c55f349",
      "SCIENTIFIC_CRITICAL": "413a5591f2b02bd97bb8dc2c7317da1f21c06acaa7efe9ec866e60a33c356b69"
    },
    "case_id": "P100-039",
    "evaluator_version": "3.0.0-rc.1"
  },
  "findings": [
    {
      "finding_id": "P100-039-F01",
      "dimensions": {
        "reliability": {
          "status": "not_assessed",
          "rationale": "",
          "evidence_ids": []
        },
        "mechanism": {
          "status": "not_assessed",
          "rationale": "",
          "evidence_ids": []
        },
        "novelty": {
          "status": "not_assessed",
          "rationale": "",
          "evidence_ids": []
        },
        "significance": {
          "status": "not_assessed",
          "rationale": "",
          "evidence_ids": []
        },
        "reproducibility": {
          "status": "not_assessed",
          "rationale": "",
          "evidence_ids": []
        },
        "impact": {
          "status": "not_assessed",
          "rationale": "",
          "evidence_ids": []
        }
      },
      "disposition": "not_assessed",
      "limitations": [],
      "checks": []
    },
    {
      "finding_id": "P100-039-F02",
      "dimensions": {
        "reliability": {
          "status": "not_assessed",
          "rationale": "",
          "evidence_ids": []
        },
        "mechanism": {
          "status": "not_assessed",
          "rationale": "",
          "evidence_ids": []
        },
        "novelty": {
          "status": "not_assessed",
          "rationale": "",
          "evidence_ids": []
        },
        "significance": {
          "status": "not_assessed",
          "rationale": "",
          "evidence_ids": []
        },
        "reproducibility": {
          "status": "not_assessed",
          "rationale": "",
          "evidence_ids": []
        },
        "impact": {
          "status": "not_assessed",
          "rationale": "",
          "evidence_ids": []
        }
      },
      "disposition": "not_assessed",
      "limitations": [],
      "checks": []
    }
  ]
}
