{
  "schema_version": "principia.review/3.0",
  "role": "computational",
  "reviewer_id": "",
  "bindings": {
    "claims_sha256": "df622bc709b70655bd6cff6be2eb5268b67be594c9f15680dddc832273f52525",
    "evidence_sha256": {
      "E001": "d12484bd180066faa0ef8b99420803a2b33038bd7f40ebd307de52e6d8590069",
      "E002": "532f2ae9b4e163fbdbdd9b0d68680030f6b0e77eb2170d2d390bf89e5a5dd23a",
      "E003": "253273d80c2a68d1107ef03f233333b247459cd3ee1e850a8190355ad9f620bd",
      "E004": "76c8bacc166c35ef3593bca0d3949a4e2136a84c915eddc70e7f7548df9c7ad4",
      "E005": "51099d2545fe1c3f3fac295735a843e3711b30b366c24a64bec897f2767c688d",
      "E006": "e492718af1078c8de5eedff35c8452d1b98764b17f48a3ec3e83aa92af8edc5c",
      "E007": "8ee13053346b879dba1065d8fffab2becde1e198e4926c5e02020ec29d1bf376",
      "E008": "737f5de7c37754f1af3f8a3b91e58a61f7341c97637f3c6ae3913db1268dc934",
      "E009": "292277a803a450aa705be1af533ff351eb9e658348cde97793bfcbff71a76198",
      "E010": "d2cfe4ba0941e02aa7a45829919e7cbc25a233efee854a2b0ac96e62f0049940",
      "E011": "5621a220eec1b797455998d2d3f997d9a261f239496d45d33e46494238799bda",
      "E012": "f7c8b32f93f1889c508e1b0ae6d343c31c4bb84b8acaa7a873211724c1159bb6",
      "E013": "b5610e2a777c9082123729f1932b0985c92e2aabc2a376a96848fbae80db586b",
      "E014": "517a1af5a9d81145c98444cf1f7d238cd5c0016699aa9af865785c2465485808",
      "E015": "9a5e54630b33a3a75996ff829073beba4d67e226d977a4a57917af7ce8cdff7e",
      "E016": "1d080733f95d41ce1868f4f02993af21bbf40b8327640f505935360543eb562a",
      "E017": "1b3cb92c861efb86ab6a504a9aa3f73a1338c98de12e8ef7cebdb0179bb7edd8",
      "E018": "c189829e40746f2af30d072d681e9f89449e721668a84856ecd3b135f6b2f145",
      "COMPUTATIONAL": "3614881ceb95a0fb53838c956d2f0bc49a73720154fb68e059f998450a85d344",
      "SCIENTIFIC_CRITICAL": "8518de32b10aa919e0b9392c4ef48fb2a2f53b5c105cfc78045be7b343b0e697"
    },
    "case_id": "P100-034",
    "evaluator_version": "3.0.0-rc.1"
  },
  "findings": [
    {
      "finding_id": "P100-034-F01",
      "dimensions": {
        "reliability": {
          "status": "not_assessed",
          "rationale": "",
          "evidence_ids": []
        },
        "mechanism": {
          "status": "not_assessed",
          "rationale": "",
          "evidence_ids": []
        },
        "novelty": {
          "status": "not_assessed",
          "rationale": "",
          "evidence_ids": []
        },
        "significance": {
          "status": "not_assessed",
          "rationale": "",
          "evidence_ids": []
        },
        "reproducibility": {
          "status": "not_assessed",
          "rationale": "",
          "evidence_ids": []
        },
        "impact": {
          "status": "not_assessed",
          "rationale": "",
          "evidence_ids": []
        }
      },
      "disposition": "not_assessed",
      "limitations": [],
      "checks": []
    },
    {
      "finding_id": "P100-034-F02",
      "dimensions": {
        "reliability": {
          "status": "not_assessed",
          "rationale": "",
          "evidence_ids": []
        },
        "mechanism": {
          "status": "not_assessed",
          "rationale": "",
          "evidence_ids": []
        },
        "novelty": {
          "status": "not_assessed",
          "rationale": "",
          "evidence_ids": []
        },
        "significance": {
          "status": "not_assessed",
          "rationale": "",
          "evidence_ids": []
        },
        "reproducibility": {
          "status": "not_assessed",
          "rationale": "",
          "evidence_ids": []
        },
        "impact": {
          "status": "not_assessed",
          "rationale": "",
          "evidence_ids": []
        }
      },
      "disposition": "not_assessed",
      "limitations": [],
      "checks": []
    },
    {
      "finding_id": "P100-034-F03",
      "dimensions": {
        "reliability": {
          "status": "not_assessed",
          "rationale": "",
          "evidence_ids": []
        },
        "mechanism": {
          "status": "not_assessed",
          "rationale": "",
          "evidence_ids": []
        },
        "novelty": {
          "status": "not_assessed",
          "rationale": "",
          "evidence_ids": []
        },
        "significance": {
          "status": "not_assessed",
          "rationale": "",
          "evidence_ids": []
        },
        "reproducibility": {
          "status": "not_assessed",
          "rationale": "",
          "evidence_ids": []
        },
        "impact": {
          "status": "not_assessed",
          "rationale": "",
          "evidence_ids": []
        }
      },
      "disposition": "not_assessed",
      "limitations": [],
      "checks": []
    }
  ]
}
