{
  "schema_version": "principia.review/3.0",
  "role": "computational",
  "reviewer_id": "",
  "bindings": {
    "claims_sha256": "8d092a2a0b855dda37a56741077c77f0f2276aa4c3f0a080d3ae0a5702cf44ba",
    "evidence_sha256": {
      "E001": "2763ab2a96a2b48d63a7e3187212940654bb560dacd5ed4fe227d0abc7b80393",
      "E002": "4874865eb390180f3d5b62a1850bc4b2f9af36051a3ef6ba2191b85cf3ef39c8",
      "E003": "cd1fdb0d2630fc3e075bc8451449adfa2ee51bbf6162e754299b9f694d61ead6",
      "E004": "1fcf404be703a7d65f6ae16f78224b52eaaec4cfd8e412a20d6ab81724259b6e",
      "E005": "1ea85fc176601a7ad6e4f143e0c658946fbc025f8ad0d49aa649de76e981c7ae",
      "E006": "485c68d6c070659eabdc81fe2fd3907dad7cf38182546b0f3dfb955ba2088b46",
      "E007": "76348477d0623a83b70143c4bc2288c19ed5f489c7b2fea9bb15811a3d4d7f1e",
      "E008": "1526e4ac6c3c9cbcbd4634edc526ce070a3deca9ad975d3aee23a8a2d18acaf1",
      "E009": "ec833a054d39d87d3108aaa8b7b01d851e4542cbf23a827c17e69c9fe400a66d",
      "E010": "90435239d1de5599f0318ad4a691a7598388a12005c8f4bd3c6b7dd12134347f",
      "E011": "53ad1570910327046946a2d68183156c9bf36568965650f000c09589b48fb8c3",
      "E012": "e1608d9f85a9a1b344e9f47e94f5a15192c8240dd79e05aeb1b4d30f1f186412",
      "E013": "981e6f2c7f04b84bd055d1d09b99fd9ee07ee9f0d337ab35f4d9ffeb9dc72a3b",
      "E014": "475d2483524ddb38d4d6e8e5e47a03cbe8986ee13262436ab1fd280d4995785e",
      "COMPUTATIONAL": "a1880f3122a2ccf7fd5966ead5b51cd290f7436bc3245b8251f133a28ccd1a21",
      "SCIENTIFIC_CRITICAL": "567ad8e3f376932b94ae0dea198837bfdb40324d4a719d130d1ac6fbf0124aa4"
    },
    "case_id": "P100-013",
    "evaluator_version": "3.0.0-rc.1"
  },
  "findings": [
    {
      "finding_id": "P100-013-F01",
      "dimensions": {
        "reliability": {
          "status": "not_assessed",
          "rationale": "",
          "evidence_ids": []
        },
        "mechanism": {
          "status": "not_assessed",
          "rationale": "",
          "evidence_ids": []
        },
        "novelty": {
          "status": "not_assessed",
          "rationale": "",
          "evidence_ids": []
        },
        "significance": {
          "status": "not_assessed",
          "rationale": "",
          "evidence_ids": []
        },
        "reproducibility": {
          "status": "not_assessed",
          "rationale": "",
          "evidence_ids": []
        },
        "impact": {
          "status": "not_assessed",
          "rationale": "",
          "evidence_ids": []
        }
      },
      "disposition": "not_assessed",
      "limitations": [],
      "checks": []
    },
    {
      "finding_id": "P100-013-F02",
      "dimensions": {
        "reliability": {
          "status": "not_assessed",
          "rationale": "",
          "evidence_ids": []
        },
        "mechanism": {
          "status": "not_assessed",
          "rationale": "",
          "evidence_ids": []
        },
        "novelty": {
          "status": "not_assessed",
          "rationale": "",
          "evidence_ids": []
        },
        "significance": {
          "status": "not_assessed",
          "rationale": "",
          "evidence_ids": []
        },
        "reproducibility": {
          "status": "not_assessed",
          "rationale": "",
          "evidence_ids": []
        },
        "impact": {
          "status": "not_assessed",
          "rationale": "",
          "evidence_ids": []
        }
      },
      "disposition": "not_assessed",
      "limitations": [],
      "checks": []
    },
    {
      "finding_id": "P100-013-F03",
      "dimensions": {
        "reliability": {
          "status": "not_assessed",
          "rationale": "",
          "evidence_ids": []
        },
        "mechanism": {
          "status": "not_assessed",
          "rationale": "",
          "evidence_ids": []
        },
        "novelty": {
          "status": "not_assessed",
          "rationale": "",
          "evidence_ids": []
        },
        "significance": {
          "status": "not_assessed",
          "rationale": "",
          "evidence_ids": []
        },
        "reproducibility": {
          "status": "not_assessed",
          "rationale": "",
          "evidence_ids": []
        },
        "impact": {
          "status": "not_assessed",
          "rationale": "",
          "evidence_ids": []
        }
      },
      "disposition": "not_assessed",
      "limitations": [],
      "checks": []
    }
  ]
}
