{
  "schema_version": "principia.review/3.0",
  "role": "computational",
  "reviewer_id": "",
  "bindings": {
    "claims_sha256": "7900d43fa28f06e1838020e2ab37f443c265ed3edf7294f538a2c642f83348e6",
    "evidence_sha256": {
      "E001": "2eb60315d34d82c32dce7770ce2489ad5af937e4e158c505f808d9a176f29fc4",
      "E002": "51756554495a5336c0c9c0c492c7c4f665627b1e52a1abe1a0c604ff521daebe",
      "E003": "15d56bb86ef27eb9e13650b5a9618b0434f270afde4be258be852a7d21af87ec",
      "E004": "9438b78a7b952653755c017c33c689cef32d3b81262c40e41e50fe77e4249d4c",
      "E005": "869513099fd91c1bd15c4b116596a5816d86798abaf82d75f7eec3f0c05a0af3",
      "E006": "efab7989e3ddd17dfc22815c99e7f20896da83565d21f9da4141ae2aa32f4362",
      "E007": "501d2733bf259db3456652baef786e1311739f16db594dfba149a52d42ddd645",
      "E008": "58fdc65713e03fb5cbbf784d34bd98b6972614734710b158d376c28e0070ef11",
      "E009": "5a190e1a22b69626cf9b1f679ebc7733ef08e6ecbcdeb14607e962f1452682a2",
      "E010": "afaad9c701c68787b2a3b5877743f3d81e18dbbd4ade27c3f64b559d85b9e35b",
      "E011": "3c2701119161f145326db7bd85dd8699c6884bf613906b344296865ec9eea0a3",
      "E012": "17cc531f06e544ed4ea2532adc7af452f404eb069ab691e5da8421bb72867253",
      "E013": "b3f8a00aec7af8025dc0ea24bf7d3e4a1f7e5510fbc0a97742c8a5c0efec1078",
      "SCIENTIFIC": "73f9a85768b8b4637041b9ba505dd45a971f6b158ec2aae8ecf40258a7e6eeb9",
      "COMPUTATIONAL": "0176ae7ba63b328d640b1f396ec862c1073f6abdab8e11befd2af0465b64e2c9"
    },
    "case_id": "P100-037",
    "evaluator_version": "3.0.0-rc.1"
  },
  "findings": [
    {
      "finding_id": "P100-037-SCI-01",
      "dimensions": {
        "reliability": {
          "status": "not_assessed",
          "rationale": "",
          "evidence_ids": []
        },
        "mechanism": {
          "status": "not_assessed",
          "rationale": "",
          "evidence_ids": []
        },
        "novelty": {
          "status": "not_assessed",
          "rationale": "",
          "evidence_ids": []
        },
        "significance": {
          "status": "not_assessed",
          "rationale": "",
          "evidence_ids": []
        },
        "reproducibility": {
          "status": "not_assessed",
          "rationale": "",
          "evidence_ids": []
        },
        "impact": {
          "status": "not_assessed",
          "rationale": "",
          "evidence_ids": []
        }
      },
      "disposition": "not_assessed",
      "limitations": [],
      "checks": []
    },
    {
      "finding_id": "P100-037-SCI-02",
      "dimensions": {
        "reliability": {
          "status": "not_assessed",
          "rationale": "",
          "evidence_ids": []
        },
        "mechanism": {
          "status": "not_assessed",
          "rationale": "",
          "evidence_ids": []
        },
        "novelty": {
          "status": "not_assessed",
          "rationale": "",
          "evidence_ids": []
        },
        "significance": {
          "status": "not_assessed",
          "rationale": "",
          "evidence_ids": []
        },
        "reproducibility": {
          "status": "not_assessed",
          "rationale": "",
          "evidence_ids": []
        },
        "impact": {
          "status": "not_assessed",
          "rationale": "",
          "evidence_ids": []
        }
      },
      "disposition": "not_assessed",
      "limitations": [],
      "checks": []
    },
    {
      "finding_id": "P100-037-SCI-03",
      "dimensions": {
        "reliability": {
          "status": "not_assessed",
          "rationale": "",
          "evidence_ids": []
        },
        "mechanism": {
          "status": "not_assessed",
          "rationale": "",
          "evidence_ids": []
        },
        "novelty": {
          "status": "not_assessed",
          "rationale": "",
          "evidence_ids": []
        },
        "significance": {
          "status": "not_assessed",
          "rationale": "",
          "evidence_ids": []
        },
        "reproducibility": {
          "status": "not_assessed",
          "rationale": "",
          "evidence_ids": []
        },
        "impact": {
          "status": "not_assessed",
          "rationale": "",
          "evidence_ids": []
        }
      },
      "disposition": "not_assessed",
      "limitations": [],
      "checks": []
    }
  ]
}
