{
  "schema_version": "principia.review/3.0",
  "role": "scientific_critical",
  "reviewer_id": "",
  "bindings": {
    "claims_sha256": "cc1f1097e2a1186d445ff30229c934a3b3d7ad7813fca71a0b720b618b129293",
    "evidence_sha256": {
      "E001": "1fd0e13bf8074ecd6d8459d348aabe09fb7c1806b5f5302f8c0c85adf34d6070",
      "E002": "d876f7424b769c2e1ddc0ecbabd2a29c9365c175f6d958983cb11d4a6a941f47",
      "E003": "8531b06cd64944865f16bdbe908aad37c26770a7d3c208c7b60fe880127278f8",
      "E004": "1092dc4bf29bf3a77b32b4ba6b91cefba9c5045b7f6ec9414d15deb621d9bf8f",
      "E005": "6d7852933ce9269fbdd656e9a7aa546c3ab4c6ef73500506f1f4f5bde5c17165",
      "E006": "1823d0d77f57384db08bcbc25d0fd06dc0b148240cd50b06ed362a673cbd0c4e",
      "E007": "0fadce05820b0e61e3e5915d8376675e2178a830a239c2aa7178b49385ef5049",
      "E008": "c65e92e7f4824adee26b37d41199f3945262957d2f8749cebf54b68e1c9ed4c0",
      "SCIENTIFIC": "f54e463d30282bc8413086abd9432abd33da8a8bf05eec3f430ec59dfdda9b68",
      "COMPUTATIONAL": "0176ae7ba63b328d640b1f396ec862c1073f6abdab8e11befd2af0465b64e2c9"
    },
    "case_id": "P100-069",
    "evaluator_version": "3.0.0-rc.1"
  },
  "findings": [
    {
      "finding_id": "P100-069-SCI-01",
      "dimensions": {
        "reliability": {
          "status": "not_assessed",
          "rationale": "",
          "evidence_ids": []
        },
        "mechanism": {
          "status": "not_assessed",
          "rationale": "",
          "evidence_ids": []
        },
        "novelty": {
          "status": "not_assessed",
          "rationale": "",
          "evidence_ids": []
        },
        "significance": {
          "status": "not_assessed",
          "rationale": "",
          "evidence_ids": []
        },
        "reproducibility": {
          "status": "not_assessed",
          "rationale": "",
          "evidence_ids": []
        },
        "impact": {
          "status": "not_assessed",
          "rationale": "",
          "evidence_ids": []
        }
      },
      "disposition": "not_assessed",
      "limitations": [],
      "checks": []
    },
    {
      "finding_id": "P100-069-SCI-02",
      "dimensions": {
        "reliability": {
          "status": "not_assessed",
          "rationale": "",
          "evidence_ids": []
        },
        "mechanism": {
          "status": "not_assessed",
          "rationale": "",
          "evidence_ids": []
        },
        "novelty": {
          "status": "not_assessed",
          "rationale": "",
          "evidence_ids": []
        },
        "significance": {
          "status": "not_assessed",
          "rationale": "",
          "evidence_ids": []
        },
        "reproducibility": {
          "status": "not_assessed",
          "rationale": "",
          "evidence_ids": []
        },
        "impact": {
          "status": "not_assessed",
          "rationale": "",
          "evidence_ids": []
        }
      },
      "disposition": "not_assessed",
      "limitations": [],
      "checks": []
    }
  ]
}
