{
  "schema_version": "principia.review/3.0",
  "role": "computational",
  "reviewer_id": "",
  "bindings": {
    "claims_sha256": "aea2f66f2f39520616a1784b2d0dbb93de211c5d21e8d39368bd676ba63cce33",
    "evidence_sha256": {
      "E001": "050554acb9042e799488b6d3322a0110f291d5e9420dbdb25017a3ce783a8492",
      "E002": "8a54aeb28b32e3e348076f95ebe26dfe6103f09ff906e5a58a79a3652577a3f2",
      "E003": "f5fb5ee3692ffa6195009af5e28f1afb2b3190c6c91ec9dbdcd70e9744929818",
      "E004": "522c58bd323955cdb9fce5bab4ba49c06c35b4bdd72be63a27b369ae78c8fb75",
      "E005": "86d74d4b7b8a9be980bc98d8205d9d21f24f252690f9b4951095fe1d833c2a31",
      "E006": "a9e91ac38574f2e4d6a121e61c542fc4751b710f5f40c3f11c8b562463bfcfac",
      "E007": "d2388fc6e7713c5e55b15aeaa90d5244c4c5a01c2f3a7b8606f409129776c9ca",
      "E008": "f6a27a9ed916938f02d426b9a69e1b76fa2f16e195166b5e1ad2081824c11d45",
      "E009": "ee5072d90749a43991dd49ea51210712d08fe71a4b02c5c7cb190c745382d989",
      "E010": "ed8c8c22073e08b1b0a5de16bc0f25ab7c456db4744797e9744a4bcab91155c3",
      "E011": "e716f5dcca3dad767bec1ebdd3e750ac956627ea2a2e3ed60219ac143f941de5",
      "E012": "2f3c1fa8e550dc862218fcf82ae81f7423800cb13500cc563410edd083608d35",
      "E013": "e49716eafa126c16d1c6185cddcec4d094ba33a4d40c4ff3de2e6d046b3ecb9b",
      "E014": "a901b11702b5e5d248005c9e22aba24ab0ec191b6bc599d84c6ccf999a41a688",
      "E015": "e96d6e43c5c795bab11ea3a7494274b644789ed4ad6ecc2132d51996057bbe3f",
      "E016": "dde8b9c8a5017dbf599a62aebc63993cd8569b979f4f3a28bdcfd97286f77e88",
      "E017": "c5a1a0141ca96f8cb186b98ac0133792f534eec11a82c08a80f38757dbc66a8e",
      "E018": "cae16e2c76920d7835f92ab60b89456e94a5109e12de128be657ae04af77a50d",
      "E019": "3a99ceabdac2c2bc86dbee7e4bd33773e1841f9f06570cf0f1aff11dedd0d626",
      "E020": "f096a38176d0964f11c5919d95881d7f515f73bfd38eb4beec8b15ed9a105572",
      "COMPUTATIONAL": "544978731954d9b2036c76a1667f8188295454fc5ef91f4823e93e1d9a2ef85e",
      "SCIENTIFIC_CRITICAL": "592ce1a1c007173d8a2f8784efa0240d461e420c73f0cbdedee02d72832515c7"
    },
    "case_id": "P100-091",
    "evaluator_version": "3.0.0-rc.1"
  },
  "findings": [
    {
      "finding_id": "P100-091-F01",
      "dimensions": {
        "reliability": {
          "status": "not_assessed",
          "rationale": "",
          "evidence_ids": []
        },
        "mechanism": {
          "status": "not_assessed",
          "rationale": "",
          "evidence_ids": []
        },
        "novelty": {
          "status": "not_assessed",
          "rationale": "",
          "evidence_ids": []
        },
        "significance": {
          "status": "not_assessed",
          "rationale": "",
          "evidence_ids": []
        },
        "reproducibility": {
          "status": "not_assessed",
          "rationale": "",
          "evidence_ids": []
        },
        "impact": {
          "status": "not_assessed",
          "rationale": "",
          "evidence_ids": []
        }
      },
      "disposition": "not_assessed",
      "limitations": [],
      "checks": []
    },
    {
      "finding_id": "P100-091-F02",
      "dimensions": {
        "reliability": {
          "status": "not_assessed",
          "rationale": "",
          "evidence_ids": []
        },
        "mechanism": {
          "status": "not_assessed",
          "rationale": "",
          "evidence_ids": []
        },
        "novelty": {
          "status": "not_assessed",
          "rationale": "",
          "evidence_ids": []
        },
        "significance": {
          "status": "not_assessed",
          "rationale": "",
          "evidence_ids": []
        },
        "reproducibility": {
          "status": "not_assessed",
          "rationale": "",
          "evidence_ids": []
        },
        "impact": {
          "status": "not_assessed",
          "rationale": "",
          "evidence_ids": []
        }
      },
      "disposition": "not_assessed",
      "limitations": [],
      "checks": []
    },
    {
      "finding_id": "P100-091-F03",
      "dimensions": {
        "reliability": {
          "status": "not_assessed",
          "rationale": "",
          "evidence_ids": []
        },
        "mechanism": {
          "status": "not_assessed",
          "rationale": "",
          "evidence_ids": []
        },
        "novelty": {
          "status": "not_assessed",
          "rationale": "",
          "evidence_ids": []
        },
        "significance": {
          "status": "not_assessed",
          "rationale": "",
          "evidence_ids": []
        },
        "reproducibility": {
          "status": "not_assessed",
          "rationale": "",
          "evidence_ids": []
        },
        "impact": {
          "status": "not_assessed",
          "rationale": "",
          "evidence_ids": []
        }
      },
      "disposition": "not_assessed",
      "limitations": [],
      "checks": []
    }
  ]
}
