{
  "schema_version": "principia.review/3.0",
  "role": "scientific_critical",
  "reviewer_id": "",
  "bindings": {
    "claims_sha256": "6ff1e5cdf5c85e2c4cd77ae95ac3f69dde1e3e89a037cfad0aaea69c7ef969a7",
    "evidence_sha256": {
      "E001": "72e0569d4c7a9ddbb256351b7904238dd4608a98abf66a7f11c13678fb32fb82",
      "E002": "0529912135763c0df97d9a7f96839dcbdff4cf770f586165f74047d5070b8c5f",
      "E003": "4e7fea642f9832fdf90111a2dedf1c314f3ef05a7a8025c48dbfc02523931c4e",
      "E004": "80ad1cc6d74d3bcb86a8924838224f64db392969227c6d10d3db42ee285c51c5",
      "E005": "e5e7bb7df87ed1cfa572ee967257f5a3b4704c4300308d24d33ff8014034b733",
      "E006": "c3c77d7e4a90ed6ae43026326c3e22fddd9acaebbe322d4e4e8cc6e2e31ce840",
      "E007": "bd680e57d952fd7f53450ba25e674fd666551c4d7f91b40761b0a00d7f867fb1",
      "E008": "80e1da31adc181974024f8279bf4351ed84cc08363d704537062e1297c9879ff",
      "E009": "0f1ea74c3b90c90b8dc64c864b12b432e96b2b1f744af25970220b11236eff57",
      "E010": "3432809f7b7e79ee19da52f2b88d68949b7e5c694d093987c848c9ef2011519c",
      "E011": "0f6444bd153bada10765954ab3d978ff55784129aac0aaaa534c4003d0e93e0b",
      "E012": "446124db4e7dd1e2705ba8b5887d08a28212190f6bba59952a8a50d6779fc183",
      "E013": "ac029085b6c01fe793df299ee424cee21e50397cd1f4b94926b6ca70b6238352",
      "E014": "bc59228c4778dacad01be23ba2130a1e0c2dad13cf7525b0ca60d3a3a53de597",
      "E015": "5d49df90b0a14ea1580d74ff353077e938eebf75806fda8b294d677ab26edc33",
      "E016": "4ea9fba98e6f7e1acd10ac206a4947e9fab72edb9e514c4894afd853c5301dc3",
      "E017": "09c62f24009a044a46856eed51e74987b1556dacbb40076679896c0440675525",
      "E018": "117521678842af2d5ec0a38d7b283ceec4a574de42869ba2050bc998f51125f0",
      "E019": "7cf5ff4bd465808a6f9a5e79d10c063f39bfc80bd271c4dec66ecd696b2e3510",
      "COMPUTATIONAL": "fe4bd137338fb6b00a1281dbc6bbd173cc3ce9cdcd97b3177684a70a1a17b4f9",
      "SCIENTIFIC_CRITICAL": "ec838135abc6888c11ea15db8c9543be5811586f1599d9ccc1fa201c20b9f5f3"
    },
    "case_id": "P100-080",
    "evaluator_version": "3.0.0-rc.1"
  },
  "findings": [
    {
      "finding_id": "P100-080-F01",
      "dimensions": {
        "reliability": {
          "status": "not_assessed",
          "rationale": "",
          "evidence_ids": []
        },
        "mechanism": {
          "status": "not_assessed",
          "rationale": "",
          "evidence_ids": []
        },
        "novelty": {
          "status": "not_assessed",
          "rationale": "",
          "evidence_ids": []
        },
        "significance": {
          "status": "not_assessed",
          "rationale": "",
          "evidence_ids": []
        },
        "reproducibility": {
          "status": "not_assessed",
          "rationale": "",
          "evidence_ids": []
        },
        "impact": {
          "status": "not_assessed",
          "rationale": "",
          "evidence_ids": []
        }
      },
      "disposition": "not_assessed",
      "limitations": [],
      "checks": []
    },
    {
      "finding_id": "P100-080-F02",
      "dimensions": {
        "reliability": {
          "status": "not_assessed",
          "rationale": "",
          "evidence_ids": []
        },
        "mechanism": {
          "status": "not_assessed",
          "rationale": "",
          "evidence_ids": []
        },
        "novelty": {
          "status": "not_assessed",
          "rationale": "",
          "evidence_ids": []
        },
        "significance": {
          "status": "not_assessed",
          "rationale": "",
          "evidence_ids": []
        },
        "reproducibility": {
          "status": "not_assessed",
          "rationale": "",
          "evidence_ids": []
        },
        "impact": {
          "status": "not_assessed",
          "rationale": "",
          "evidence_ids": []
        }
      },
      "disposition": "not_assessed",
      "limitations": [],
      "checks": []
    }
  ]
}
